index,question,answer
243,How can I find reliable information on travel scams?,"Read travel blogs focused on safety, check forums like TripAdvisor, and look at government travel advisory pages."
244,What are some websites for booking river cruises?,"Check sites like Viking River Cruises, AmaWaterways, and CruiseCritic for options and reviews on river cruises."
245,How do I find out about local festivals and events?,"Use local tourism websites, Time Out, Eventbrite, and cultural blogs to stay updated on local festivals and events."
246,What are some websites for booking wellness retreats?,"Explore BookRetreats, Retreat Guru, and Wellbeing Escapes for a range of wellness and yoga retreat options."
247,How can I find travel podcasts for inspiration?,"Search on platforms like Apple Podcasts, Spotify, and Google Podcasts for popular travel podcasts such as The Travel Diaries and Extra Pack of Peanuts."
248,What are some reliable websites for renting vacation homes?,"Airbnb, VRBO, HomeAway, and Booking.com offer extensive listings of vacation rentals worldwide."
249,How do I find local travel guides?,"Use platforms like ToursByLocals, Context Travel, and Withlocals to find knowledgeable local guides."
250,What are some websites for travel gear reviews?,"Check sites like Gear Patrol, Outdoor Gear Lab, and The Wirecutter for in-depth reviews on travel gear and equipment."
251,How can I find travel contests and giveaways?,"Follow travel brands on social media, check travel blogs, and visit contest aggregation sites like Contest Listing and Travel Competitions."
252,What are some websites for booking budget accommodations?,"Hostelworld, Booking.com, Agoda, and Couchsurfing offer a variety of budget-friendly lodging options."
253,How do I find reliable travel weather information?,"Use AccuWeather, Weather.com, and Wunderground for detailed and reliable weather forecasts for your travel destination."
254,What are some websites for finding offbeat travel experiences?,"Atlas Obscura, Culture Trip, and Roadtrippers provide information on unusual and unique travel experiences."
255,How can I find language learning resources for travel?,"Use websites like Duolingo, Rosetta Stone, Babbel, and FluentU to learn basic phrases and language skills before traveling."
256,What are some websites for travel volunteer opportunities?,"Visit GoAbroad, Volunteer HQ, Workaway, and WWOOF for opportunities to volunteer while traveling."
257,How do I find sustainable travel initiatives?,"Check platforms like Sustainable Travel International, The International Ecotourism Society, and Green Global Travel."
258,What are some websites for booking last-minute accommodations?,"Use HotelTonight, Booking.com, Expedia, and Priceline for finding last-minute hotel deals."
259,How do I find cultural heritage sites?,"Visit UNESCO’s World Heritage Centre, check national park websites, and use travel guides like Lonely Planet."
260,What are some websites for planning solo travel?,"Solo Traveler, Journeywoman, and Intrepid Travel offer resources, tips, and tours specifically for solo travelers."
261,How can I find food tours online?,"Look at platforms like Secret Food Tours, Culinary Backstreets, and Eating Europe for food-focused travel experiences."
262,What are some websites for travel packing tips?,"Visit OneBag, Travel Fashion Girl, and Her Packing List for detailed packing guides and tips."
263,How do I find medical travel information?,"Consult the CDC’s Travelers’ Health page, WHO’s travel health updates, and TravelHealthPro for medical advice and information."
264,What are some websites for finding travel grants and scholarships?,"Check out GoAbroad, FundMyTravel, and the Hostelling International USA Explore the World Travel Scholarship."
265,How can I find travel hacking tips?,"Follow blogs like The Points Guy, Million Mile Secrets, and Nomadic Matt for tips on travel hacking and maximizing rewards."
266,What are some websites for booking unique travel experiences?,"Use Airbnb Experiences, Viator, Atlas Obscura, and GetYourGuide for booking unique and memorable travel activities."
267,How do I find information on travel visas?,"Visit government websites, use VisaHQ, and refer to embassy websites for accurate visa information and requirements."
268,What are some websites for family travel tips?,"Visit Family Vacation Critic, Travel Mamas, and MiniTime for advice and tips on traveling with children."
269,How can I find eco-friendly travel accommodations?,"Check Green Pearls, EcoHotels.com, and use filters on Booking.com to find eco-friendly lodging options."
270,What are some websites for LGBTQ+ travel tips?,"Explore resources like Travel Gay, Out Adventures, and IGLTA for travel tips and LGBTQ+ friendly destinations."
271,How do I find travel information for seniors?,"Visit websites like ElderTreks, Road Scholar, and AARP Travel for advice and tours tailored for senior travelers."
272,What are some websites for booking travel packages?,"Use Expedia, Travelocity, Orbitz, and Kayak to find and book comprehensive travel packages."
273,How can I find local food recommendations online?,"Use Yelp, TripAdvisor, Zomato, and local food blogs to discover recommended local eateries and dishes."
274,What are some websites for finding remote work travel opportunities?,"Explore Remote Year, WiFi Tribe, and Outsite for programs that combine remote work with travel."
275,How do I find travel photography locations?,"Check ShotHotspot, PIXEO, and 500px for popular photography spots and hidden gems."
276,What are some websites for booking luxury travel experiences?,"Use Virtuoso, Jetsetter, and Mr & Mrs Smith for luxury travel bookings and experiences."
277,How can I find local festivals while traveling?,"Visit websites like Fest300, Everfest, and local tourism boards for information on upcoming festivals."
278,What are some websites for booking adventure tours?,"G Adventures, Intrepid Travel, and Adventure.com offer a variety of adventure tours and experiences."
279,How do I find travel budget calculators?,"Use sites like Budget Your Trip, TravelMath, and Nomadic Matt’s travel budget calculator to plan your expenses."
280,What are some websites for travel visa services?,"VisaHQ, iVisa, and CIBTvisas provide visa services and information for travelers."
281,How can I find travel tips for solo female travelers?,"Visit Solo Traveler, Women on the Road, and Her Packing List for advice and resources for solo female travelers."
282,What are some websites for booking group travel?,"Group Travel, G Adventures, and Intrepid Travel offer options for booking group tours and travel packages."
283,How do I find travel guides for specific destinations?,"Use Lonely Planet, Rough Guides, and Fodor’s for detailed travel guides and information on specific destinations."
284,What are some websites for booking cultural experiences?,"Check Airbnb Experiences, Context Travel, and Withlocals for cultural tours and activities."
285,How can I find budget travel destinations?,"Visit Budget Travel, Nomadic Matt, and The Poor Traveler for recommendations on affordable travel destinations."
286,What are some websites for booking cruises?,"Cruise Critic, Expedia Cruises, and Vacations To Go offer a variety of cruise options and deals."
287,How do I find travel safety information for women?,"Check out Journeywoman, Her Adventures, and Wanderful for safety tips and resources for female travelers."
288,What are some websites for learning about travel rewards programs?,"The Points Guy, Million Mile Secrets, and NerdWallet provide information and tips on travel rewards programs."
289,How can I find travel deals for students?,"Visit StudentUniverse, STA Travel, and ISIC for discounts and deals specifically for student travelers."
290,What are some websites for booking spa vacations?,"Use SpaFinder, Wellbeing Escapes, and Healing Holidays to find and book spa and wellness vacations."
291,How do I find travel planning tools?,"Explore TripIt, Roadtrippers, and Google Trips for tools to help plan and organize your travel."
292,What are some websites for comparing travel insurance?,"InsureMyTrip, Squaremouth, and TravelInsurance.com offer comparison tools for travel insurance policies."
293,How can I find travel tips for digital nomads?,"Visit Nomad List, Remote Year, and Digital Nomad Soul for advice and resources for digital nomads."
294,What are some websites for finding road trip routes?,"Use Roadtrippers, Furkot, and Google Maps to plan and discover road trip routes and attractions."
295,How do I find travel information for backpackers?,"Visit Backpacker Banter, The Broke Backpacker, and BackpackingMatt for tips and guides for backpackers."
296,What are some websites for finding travel companions?,"Join Travello, Meetup, and Backpackr to connect with potential travel companions."
297,How can I find ethical travel options?,"Explore Responsible Travel, Ethical Traveler, and Tourism Concern for ethical travel options and tips."
298,What are some websites for booking romantic getaways?,"Use Mr & Mrs Smith, Tablet Hotels, and Jetsetter for booking romantic travel experiences."
299,How do I find travel photography contests?,"Check platforms like National Geographic, Smithsonian, and Travel Photographer of the Year for contests and submission guidelines."
300,What are some websites for booking ski vacations?,"Visit Ski.com, SnowPak, and Expedia for booking ski vacation packages and accommodations."
301,Is it safe to travel to Pakistan?,"Yes, but it's important to stay informed about current events, follow local guidelines, and avoid certain areas with travel advisories."
302,What are the best places to visit in Pakistan?,"Popular destinations include Hunza Valley, Skardu, Lahore, Islamabad, Karachi, and the ancient city of Taxila."
303,What is the best time to visit Pakistan?,"The best time to visit is during spring (March to May) and autumn (September to November) when the weather is mild."
304,What should I know about Pakistan's visa requirements?,"Visitors typically need a visa, which can be obtained through Pakistan's online visa system or at an embassy."
305,What are the top cultural sites to visit in Pakistan?,"Mohenjo-daro, Lahore Fort, Badshahi Mosque, Rohtas Fort, and Faisal Mosque are significant cultural and historical sites."
306,How can I travel between cities in Pakistan?,"You can travel by domestic flights, trains, buses, or hire private cars."
307,What are some tips for traveling in Pakistan during Ramadan?,"Be respectful of fasting customs, plan meals accordingly, and expect some businesses to have different hours."
308,What are the best trekking routes in Pakistan?,"Fairy Meadows, Nanga Parbat Base Camp, Ratti Gali Lake, and K2 Base Camp are popular trekking routes."
309,What languages are spoken in Pakistan?,"Urdu is the national language, while Punjabi, Sindhi, Pashto, and Balochi are also widely spoken."
310,What are some tips for staying safe in Pakistan?,"Stay aware of your surroundings, follow local advice, avoid protests and large gatherings, and use reputable transportation."
311,How can I find reliable guides for traveling in Pakistan?,"Look for licensed tour operators, check reviews on platforms like TripAdvisor, and ask for recommendations from other travelers."
312,What is the local currency in Pakistan?,"The local currency is the Pakistani Rupee (PKR)."
313,What are the best shopping destinations in Pakistan?,"Lahore's Liberty Market, Karachi's Zainab Market, and Islamabad's Centaurus Mall are popular shopping spots."
314,What traditional foods should I try in Pakistan?,"Biryani, Nihari, Haleem, Chapli Kebab, and Samosas are must-try traditional dishes."
315,What are some good resources for learning about Pakistan's history?,"Visit local museums, read guidebooks, explore online resources, and take guided tours to learn about Pakistan's rich history."
316,What are some recommended hotels in Islamabad?,"The Serena Hotel, Marriott Hotel, and Ramada by Wyndham are highly recommended."
317,How can I travel from Islamabad to Gilgit-Baltistan?,"You can fly from Islamabad to Gilgit or Skardu, or take a scenic road trip through the Karakoram Highway."
318,What are some must-see attractions in Lahore?,"Badshahi Mosque, Lahore Fort, Shalimar Gardens, and the Lahore Museum are must-see attractions."
319,What are the best beaches in Pakistan?,"Clifton Beach in Karachi, Gwadar Beach, and Manora Island are popular beach destinations."
320,How can I access Wi-Fi while traveling in Pakistan?,"Wi-Fi is available in most hotels, cafes, and public areas. You can also buy a local SIM card with data."
321,What are some eco-friendly travel options in Pakistan?,"Stay at eco-friendly lodges, use public transportation, and participate in community-based tourism initiatives."
322,What are the best festivals to experience in Pakistan?,"The Lahore Literary Festival, Basant (kite festival), and the Shandur Polo Festival are popular events."
323,What should I pack for a trip to Pakistan?,"Pack modest clothing, comfortable shoes, a hat, sunscreen, and any necessary medications."
324,How can I respect local customs and traditions in Pakistan?,"Dress modestly, be polite, remove shoes when entering homes or mosques, and avoid public displays of affection."
325,What are some tips for female travelers in Pakistan?,"Dress conservatively, consider traveling with a guide, stay in reputable accommodations, and be cautious in public spaces."
326,What is the public transportation like in major cities in Pakistan?,"Public transportation includes buses, rickshaws, and ride-hailing services like Uber and Careem."
327,What are some popular outdoor activities in Pakistan?,"Hiking, trekking, mountaineering, and exploring national parks are popular outdoor activities."
328,How do I exchange money in Pakistan?,"You can exchange money at airports, banks, and authorized exchange centers. ATMs are also widely available."
329,What are some must-visit natural landscapes in Pakistan?,"The Karakoram Range, Deosai National Park, Saiful Muluk Lake, and the Thar Desert are stunning natural landscapes."
330,How can I stay healthy while traveling in Pakistan?,"Drink bottled water, eat freshly cooked food, carry hand sanitizer, and consult a doctor for any required vaccinations."
331,What are some traditional crafts to buy in Pakistan?,"Handwoven rugs, pottery, leather goods, and embroidered textiles are popular traditional crafts."
332,What are the best places for adventure sports in Pakistan?,"Skardu for mountaineering, Hunza for trekking, and the Indus River for white-water rafting."
333,What should I know about tipping in Pakistan?,"Tipping is appreciated but not mandatory. A 10% tip in restaurants and small tips for hotel staff are customary."
334,How do I get from Karachi to Lahore?,"You can fly, take a train, or travel by bus between Karachi and Lahore."
335,What are some popular day trips from Islamabad?,"Murree, Taxila, and Rawalpindi are popular day trip destinations from Islamabad."
336,What are some must-visit historical sites in Pakistan?,"Mohenjo-daro, Harappa, Rohtas Fort, and the ancient Buddhist ruins in Takht-i-Bahi."
337,How can I find halal food in Pakistan?,"Halal food is widely available as Pakistan is a predominantly Muslim country."
338,What are the best places to visit in northern Pakistan?,"Hunza Valley, Skardu, Fairy Meadows, and Naran Kaghan Valley are top destinations in northern Pakistan."
339,What are some travel tips for visiting Karachi?,"Stay aware of your surroundings, avoid certain areas at night, and use reputable transportation options."
340,What are the best ways to travel around Lahore?,"Use ride-hailing apps, rickshaws, or hire a private car for convenient travel around Lahore."
341,How do I find accommodation in remote areas of Pakistan?,"Look for guesthouses, homestays, and small hotels in remote areas. Booking in advance is recommended."
342,What are some essential phrases to learn in Urdu for traveling?,"Learn greetings like 'Assalamu Alaikum' (peace be upon you), 'Shukriya' (thank you), and 'Kitna hai?' (how much?)."
343,What are the best places for photography in Pakistan?,"Fairy Meadows, Hunza Valley, Badshahi Mosque, and Mohenjo-daro are excellent spots for photography."
344,How can I travel from Lahore to Islamabad?,"You can travel by air, train, or bus between Lahore and Islamabad."
345,What are some tips for visiting Pakistan in the summer?,"Stay hydrated, wear light clothing, use sunscreen, and plan outdoor activities in the early morning or late afternoon."
346,What are the best places to visit in the winter in Pakistan?,"Murree, Malam Jabba, Swat Valley, and Skardu offer beautiful winter landscapes and activities."
347,What are some recommended restaurants in Islamabad?,"Monal Restaurant, The Royal Elephant, and The Warehouse are popular dining options in Islamabad."
348,How can I find travel agencies in Pakistan?,"Look for recommendations online, check reviews, and use local directories to find reputable travel agencies."
349,What are some family-friendly travel destinations in Pakistan?,"Murree, Islamabad, Lahore, and Fairy Meadows are great destinations for family trips."
350,What are some tips for visiting religious sites in Pakistan?,"Dress modestly, remove shoes, be respectful of religious practices, and ask for permission before taking photos."
351,How do I find information about local events in Pakistan?,"Check local tourism websites, social media pages, and ask at your hotel for information on local events."
352,What are some popular museums to visit in Pakistan?,"The Lahore Museum, Pakistan Museum of Natural History, and Mohatta Palace Museum are worth visiting."
353,What is the drinking water situation in Pakistan?,"It's advisable to drink bottled or filtered water to avoid any health issues."
354,What are some tips for using public transportation in Pakistan?,"Use ride-hailing apps for convenience, be aware of your belongings, and avoid overcrowded buses."
355,What are the best hiking trails in Pakistan?,"Nanga Parbat Base Camp, Fairy Meadows, Margalla Hills, and Ratti Gali Lake offer excellent hiking trails."
356,How can I access healthcare while traveling in Pakistan?,"Major cities have good healthcare facilities, but it's advisable to have travel insurance and keep emergency numbers handy."
357,What are some recommended books about traveling in Pakistan?,"'Travels in a Dervish Cloak' by Isambard Wilkinson and 'Pakistan: A Hard Country' by Anatol Lieven are insightful reads."
358,What are some tips for visiting bazaars in Pakistan?,"Bargain politely, be cautious of pickpockets, and enjoy the vibrant atmosphere."
359,What are the best parks to visit in Pakistan?,"Margalla Hills National Park, Shalimar Gardens, Changa Manga Forest Park, and Khunjerab National Park are great options."
360,How can I find local tour operators in Pakistan?,"Search online, read reviews on travel forums, and ask for recommendations from fellow travelers."
361,What are the best places to experience Pakistani culture?,"Lahore for its festivals, Karachi for its diverse culture, and Peshawar for its traditional heritage."
362,What are some travel tips for visiting Swat Valley?,"Travel with a guide, respect local customs, and enjoy the beautiful landscapes and historical sites."
363,How do I find vegetarian food in Pakistan?,"Many Pakistani dishes are vegetarian. Look for Daal (lentils), Sabzi (vegetables), and Aloo dishes."
364,What are the best places for bird watching in Pakistan?,"Haleji Lake, Kallar Kahar Lake, and Chitral Gol National Park are excellent for bird watching."
365,What are some recommended travel blogs about Pakistan?,"Follow blogs like 'The Karakoram Club,' 'Lost with Purpose,' and 'The Broke Backpacker' for insights and tips."
366,What are some tips for driving in Pakistan?,"Drive defensively, be aware of local driving habits, and consider hiring a driver if you're not used to local conditions."
367,How can I find halal restaurants in Pakistan?,"Most restaurants in Pakistan serve halal food, but you can ask or check for halal certification if in doubt."
368,What are the best places for scuba diving in Pakistan?,"Churna Island near Karachi is a popular spot for scuba diving."
369,How do I get from Islamabad to Murree?,"You can take a taxi, private car, or a bus from Islamabad to Murree."
370,What are some tips for visiting Karachi?,"Be mindful of your belongings, avoid certain areas at night, and enjoy the city's diverse culture and cuisine."
371,What are the best places for stargazing in Pakistan?,"Skardu, Deosai National Park, and the Thar Desert offer excellent stargazing opportunities."
372,What are some must-visit places in the Punjab province?,"Lahore, Multan, Faisalabad, and the Salt Range are must-visit places in Punjab."
373,How can I find travel tips for visiting Sindh province?,"Check travel guides, local tourism websites, and blogs for tips on visiting Sindh."
374,What are the best places to visit in Balochistan province?,"Gwadar, Ziarat, Hingol National Park, and the Quetta Valley are notable destinations."
375,What are some tips for visiting religious festivals in Pakistan?,"Respect local customs, dress modestly, and participate respectfully in the festivities."
376,What are the best places for camping in Pakistan?,"Fairy Meadows, Ratti Gali Lake, and Deosai National Park are popular camping spots."
377,How can I find local guides in Pakistan?,"Look for recommendations on travel forums, ask at your hotel, and check online reviews."
378,What are some must-try street foods in Pakistan?,"Try Golgappa, Chaat, Bun Kebab, Seekh Kebabs, and Jalebi from street vendors."
379,What are the best places for mountaineering in Pakistan?,"K2, Nanga Parbat, and Broad Peak are top mountaineering destinations."
380,How can I find travel deals for Pakistan?,"Check travel websites, subscribe to newsletters, and look for deals on flights and accommodations."
381,What are the best places to experience Sufi culture in Pakistan?,"Lahore, Multan, and Sehwan Sharif are known for their Sufi shrines and festivals."
382,What are some tips for visiting Peshawar?,"Respect local customs, stay aware of your surroundings, and explore the city's rich history and culture."
383,How do I find information about trekking permits in Pakistan?,"Check with local tourism offices, travel agencies, or online resources for trekking permit information."
384,What are the best places for paragliding in Pakistan?,"Islamabad, Swat Valley, and Chitral offer paragliding opportunities."
385,What are some recommended hostels in Pakistan?,"Backpacker Hostel in Islamabad, Lahore Backpackers, and Indus Lodge in Hunza are popular among travelers."
386,What are the best places to see wildlife in Pakistan?,"Hingol National Park, Deosai National Park, and Chitral Gol National Park are great for wildlife viewing."
387,How can I find local festivals in Pakistan?,"Check local tourism websites, social media, and ask locals for information on festivals."
388,What are some tips for using ATMs in Pakistan?,"Use ATMs at banks, avoid using them at night, and be aware of your surroundings."
389,What are the best places for fishing in Pakistan?,"The Indus River, Mangla Dam, and Tarbela Dam are popular fishing spots."
390,How do I find travel tips for visiting Gilgit-Baltistan?,"Check travel blogs, forums, and local tourism websites for tips on visiting Gilgit-Baltistan."
391,What are some recommended books on Pakistani culture?,"'Pakistan: A Personal History' by Imran Khan and 'In Other Rooms, Other Wonders' by Daniyal Mueenuddin are insightful."
392,What are the best places for boating in Pakistan?,"Keenjhar Lake, Rawal Lake, and Lake Saiful Muluk are popular boating destinations."
393,How can I find local artisans in Pakistan?,"Visit local markets, ask at your hotel, and look for cultural centers promoting local crafts."
394,What are some tips for visiting Hunza Valley?,"Travel with a guide, respect local customs, and enjoy the stunning scenery and hospitality."
395,What are the best places for rock climbing in Pakistan?,"Margalla Hills, Passu Cones, and the Karakoram Range are excellent for rock climbing."
396,How can I find travel forums about Pakistan?,"Join travel forums on platforms like TripAdvisor, Lonely Planet, and Reddit for discussions and tips."
397,What are some tips for visiting Gwadar?,"Stay informed about the security situation, enjoy the coastal views, and explore the local markets."
398,What are the best places for a honeymoon in Pakistan?,"Hunza Valley, Swat Valley, and Murree are popular honeymoon destinations."
399,How do I find travel insurance for visiting Pakistan?,"Use comparison websites like Squaremouth, InsureMyTrip, and TravelInsurance.com to find travel insurance."
400,What are some tips for visiting national parks in Pakistan?,"Respect the environment, follow park rules, hire local guides, and carry necessary supplies."
401,What are the best places for skiing in Pakistan?,"Malam Jabba and Naltar Valley are top skiing destinations in Pakistan."
402,How can I find travel agencies for adventure tourism in Pakistan?,"Look for agencies like Karakoram Expeditions, Adventure Tours Pakistan, and Hunza Guides."
403,What are some tips for visiting Taxila?,"Explore the archaeological sites, visit the Taxila Museum, and hire a guide for a comprehensive experience."
404,What are the best places to visit in Khyber Pakhtunkhwa province?,"Swat Valley, Chitral, Abbottabad, and Naran are notable destinations in Khyber Pakhtunkhwa."
405,How can I find halal accommodations in Pakistan?,"Most hotels and accommodations in Pakistan are halal, but you can confirm with the property beforehand."
406,What are some tips for visiting Multan?,"Respect local customs, visit the historical shrines, and explore the local markets for traditional crafts."
