index,question,answer
569,How can I ensure my electronics stay charged while traveling?,"Carry a portable charger, use adapters or converters, and conserve battery when possible."
570,How can I find information about local hiking trails in Pakistan?,"Check with local tourism offices, online hiking forums, and guidebooks for information on hiking trails."
571,What are some tips for visiting the Khyber Pass?,"Stay informed about security conditions, travel with a guide, and respect local customs and regulations."
572,What are the best places for eco-tourism in Pakistan?,"Gilgit-Baltistan, Swat Valley, and the Thar Desert are ideal for eco-tourism."
573,How can I find travel tips for visiting the Cholistan Desert?,"Check travel blogs, forums, and local tourism websites for tips on visiting the Cholistan Desert."
574,What are some tips for visiting the Thar Desert?,"Travel with a guide, carry sufficient water, and explore the unique culture and landscapes of the Thar Desert."
575,How do I handle currency exchange while traveling internationally?,"Use ATMs for local currency, compare exchange rates, and avoid exchanging money at airports or touristy areas."
576,How can I find travel information for visiting the Kalash Valleys?,"Check online resources, guidebooks, and local tourism websites for information on visiting the Kalash Valleys."
577,What are some tips for visiting the Hingol National Park?,"Hire a local guide, respect wildlife and natural habitats, and bring necessary supplies for the trip."
578,What are the best places for cultural tourism in Pakistan?,"Lahore, Karachi, Peshawar, and Taxila are rich in cultural heritage and tourism opportunities."
579,How can I find travel tips for visiting the Shandur Pass?,"Check travel blogs, forums, and local tourism websites for tips on visiting the Shandur Pass."
580,What are some tips for visiting the Margalla Hills?,"Wear comfortable hiking shoes, bring water and snacks, and enjoy the scenic trails and viewpoints."
581,What are the best places for wildlife safaris in Pakistan?,"Deosai National Park, Hingol National Park, and Lal Suhanra National Park offer wildlife safari experiences."
582,How can I find travel information for visiting the Khunjerab Pass?,"Check online resources, guidebooks, and local tourism websites for information on visiting the Khunjerab Pass."
583,What are some tips for visiting the Ratti Gali Lake?,"Travel with a guide, respect the natural environment, and enjoy the stunning views of Ratti Gali Lake."
584,What are some ways to meet other travelers while on the road?,"Stay in social hostels, join group tours or activities, and use social media platforms for travelers."
585,How can I find information about local markets in Pakistan?,"Ask locals, check travel guides, and explore online resources for information on local markets."
586,What are some tips for visiting the Neelum Valley?,"Travel with a guide, respect local customs, and enjoy the stunning natural landscapes of the Neelum Valley."
587,What are some tips for traveling with pets?,"Research pet-friendly accommodations and transportation options, pack essentials for your pet, and ensure they have proper identification."
588,How can I find travel tips for visiting the Swat Valley?,"Check travel blogs, forums, and local tourism websites for tips on visiting the Swat Valley."
589,What are some tips for visiting the Fairy Meadows?,"Travel with a guide, respect the environment, and enjoy the breathtaking views of Nanga Parbat."
590,How can I reduce my carbon footprint while traveling?,"Choose eco-friendly transport, support sustainable tourism, and reduce waste."
591,How can I find travel information for visiting the Karakoram Highway?,"Check online resources, guidebooks, and local tourism websites for information on traveling the Karakoram Highway."
592,What are some tips for visiting the Skardu Valley?,"Travel with a guide, prepare for changing weather conditions, and respect local customs and environments."
593,What are the best places for water sports in Pakistan?,"Clifton Beach, Keenjhar Lake, and Rawal Lake offer various water sports activities."
594,How can I find local music performances in Pakistan?,"Check with cultural centers, local event listings, and social media for music performance schedules."
595,What are some tips for visiting the Hunza Valley?,"Travel with a guide, respect local customs, and enjoy the stunning scenery and hospitality of the Hunza people."
596,What are the best places for glamping in Pakistan?,"Fairy Meadows, Skardu, and Deosai National Park offer glamping experiences."
597,How can I find information about local art galleries in Pakistan?,"Check with local cultural centers, art institutions, and online resources for information on art galleries."
598,What are some tips for visiting the Chitral Valley?,"Travel during the summer, hire a local guide, and enjoy the cultural and natural beauty of the Chitral Valley."
599,What are the best places for rock climbing in Pakistan?,"Margalla Hills, Passu Cones, and the Karakoram Range are popular for rock climbing."
600,How can I find travel information for visiting the Makran Coast?,"Check online resources, guidebooks, and local tourism websites for information on visiting the Makran Coast."
601,What are some tips for visiting the Neelum Valley?,"Travel with a guide, respect local customs, and enjoy the stunning natural landscapes."
602,What are the best places for scuba diving in Pakistan?,"Churna Island and the coastal areas near Gwadar offer good scuba diving spots."
603,How do I choose the right travel insurance?,"Look for policies that cover medical emergencies, trip cancellations, lost luggage, and other travel-related risks. Compare different providers and read reviews to find the best coverage for your needs."
604,What are some tips for traveling with children?,"Pack snacks and entertainment, plan for breaks, keep a flexible schedule, and ensure you have all necessary documents and medications. Also, consider child-friendly accommodations and activities."
605,How can I make long flights more comfortable?,"Wear comfortable clothing, stay hydrated, move around periodically, bring neck pillows and eye masks, and consider downloading movies or books for entertainment."
606,What should I know about currency exchange rates when traveling?,"Check the current exchange rates before you travel, use reputable exchange services, and be aware of any fees. Consider using credit cards that offer favorable exchange rates."
607,What are some tips for traveling with pets?,"Ensure your pet has proper identification, health certificates, and vaccinations. Use appropriate carriers, plan for breaks, and research pet-friendly accommodations and activities."
608,How can I ensure my home is secure while I'm traveling?,"Ask a neighbor or friend to check on your home, use timers for lights, lock all windows and doors, and consider using security cameras or alarm systems."
609,What are the benefits of traveling during the off-peak season?,"Off-peak travel can offer lower prices, fewer crowds, and a more relaxed experience. However, be aware that some attractions may have limited hours or be closed."
610,How can I manage my finances while traveling?,"Use a mix of payment methods (cash, credit cards, travel cards), inform your bank of your travel plans, keep track of your spending, and use apps to manage your budget."
611,What are some must-have travel apps?,"Apps like Google Maps, TripAdvisor, Airbnb, Skyscanner, and language translation apps can enhance your travel experience by providing information, reviews, and booking options."
612,What are some tips for navigating airports efficiently?,"Arrive early, check-in online, pack light, be aware of security regulations, and use apps to track your flight status and navigate the airport layout."
613,What is the best way to avoid tourist traps?,"Research in advance, read reviews, and ask locals for recommendations."
614,How can I keep my valuables safe while traveling?,"Use hotel safes, carry a money belt, and keep copies of important documents."
615,What are the advantages of group tours?,"Convenience, guided experiences, and meeting new people."
616,How do I deal with language barriers?,"Learn basic phrases, use translation apps, and rely on body language."
617,What are some tips for traveling with dietary restrictions?,"Research food options, inform restaurants in advance, and carry snacks."
618,How do I avoid getting sick while traveling?,"Stay hydrated, wash hands frequently, and avoid street food."
619,What should I know about tipping customs in different countries?,"Research tipping practices and carry small denominations for tips."
620,How can I find authentic local experiences?,"Interact with locals, join community events, and avoid touristy areas."
621,What are some ways to stay fit while traveling?,"Walk or bike, use hotel gyms, and do bodyweight exercises."
622,How do I handle lost luggage?,"Report immediately, keep receipts for essentials, and know your rights."
623,What are some tips for booking budget accommodations?,"Use comparison websites, read reviews, and consider hostels or homestays."
624,How can I make the most of a layover?,"Explore the airport amenities, take a city tour, or rest in a lounge."
625,What is travel hacking?,"Using points and miles to get free or discounted travel."
626,How do I choose the right backpack for travel?,"Consider size, comfort, and features like compartments and security."
627,What should I do if my passport is lost or stolen?,"Report to local authorities, contact your embassy, and get a replacement."
628,What are some travel photography tips?,"Use natural light, focus on composition, and capture candid moments."
629,How do I handle travel fatigue?,"Rest, hydrate, and maintain a balanced diet."
630,What are some important things to know about travel visas?,"Check requirements early, apply in advance, and understand the conditions."
631,How can I travel sustainably?,"Choose eco-friendly options, support local businesses, and minimize waste."
632,What are the benefits of travel insurance?,"Coverage for medical emergencies, trip cancellations, and lost luggage."
633,What is the best way to travel light?,"Pack versatile clothing, use packing cubes, and limit electronics."
634,How do I prepare for altitude sickness?,"Acclimate slowly, stay hydrated, and avoid strenuous activity initially."
635,What should I know about international driving permits?,"Check if required, apply in advance, and understand local driving laws."
636,How can I find cheap flights?,"Use fare comparison websites, set alerts, and be flexible with dates."
637,What are some tips for traveling during a pandemic?,"Check travel advisories, follow health guidelines, and carry extra supplies."
638,How can I stay organized while traveling?,"Use travel apps, keep an itinerary, and pack systematically."
639,What are some benefits of traveling by train?,"Scenic routes, comfort, and avoiding airport hassles."
640,How do I handle cultural differences?,"Be respectful, observe local customs, and keep an open mind."
641,What should I pack in my carry-on bag?,"Essentials like documents, medications, electronics, and a change of clothes."
642,How can I find the best local food?,"Ask locals, use food apps, and explore street markets."
643,What are some tips for dealing with travel delays?,"Stay informed, keep essentials handy, and have a backup plan."
644,How can I make friends while traveling?,"Stay in social accommodations, join group activities, and be approachable."
645,What are some essentials for beach vacations?,"Sunscreen, swimwear, a hat, sunglasses, and a beach towel."
646,How can I manage work while traveling?,"Set a schedule, use remote work tools, and find reliable Wi-Fi."
647,What are some tips for eco-friendly travel?,"Use reusable items, choose green accommodations, and travel by public transport."
648,How do I choose a travel destination?,"Consider interests, budget, and safety."
649,What are some important safety tips for traveling at night?,"Stay in well-lit areas, avoid isolated places, and stay aware of your surroundings."
650,How can I find unique souvenirs?,"Visit local markets, buy handmade goods, and avoid tourist shops."
651,What are the benefits of solo travel?,"Personal growth, flexibility, and meeting new people."
652,How do I plan a road trip?,"Map your route, check your vehicle, and pack essentials."
653,What should I do if I miss my flight?,"Contact the airline immediately, know your rights, and have a backup plan."
654,How can I reduce travel stress?,"Plan ahead, stay flexible, and practice mindfulness."
655,What are some must-have items for camping trips?,"Tent, sleeping bag, first aidkit, and cooking supplies."
656,How do I stay healthy while eating out?,"Choose balanced meals, avoid excessive junk food, and stay hydrated."
657,What are some tips for booking last-minute travel?,"Use last-minute deal websites, be flexible, and travel off-peak."
658,How can I avoid pickpockets?,"Use a money belt, stay alert, and avoid showing valuables."
659,What should I know about travel vaccinations?,"Check required vaccines, get them in advance, and keep records."
660,How do I choose the right travel guidebook?,"Consider your destination, read reviews, and check publication dates."
661,What are some benefits of house sitting while traveling?,"Free accommodation, living like a local, and caring for pets."
662,How can I make travel more affordable?,"Use travel rewards, look for deals, and budget your expenses."
663,What should I do if I get sick while traveling?,"Seek medical help, have travel insurance, and carry basic medications."
664,How do I navigate a new city?,"Use maps, public transport apps, and ask locals for directions."
665,What are some tips for hiking trips?,"Wear proper footwear, carry water, and know the trail."
666,How can I make the most of a short trip?,"Plan efficiently, prioritize must-see attractions, and stay central."
667,What are some ways to experience local culture?,"Attend festivals, take cooking classes, and stay with locals."
668,How can I avoid overpacking?,"Make a packing list, choose multipurpose items, and stick to essentials."
669,What should I know about renting a car abroad?,"Check rental requirements, insurance coverage, and driving laws."
670,How do I handle travel anxiety?,"Prepare well, practice relaxation techniques, and focus on positive aspects."
671,What are some tips for visiting museums and galleries?,"Go early, buy tickets in advance, and take guided tours."
672,How can I ensure my electronics work abroad?,"Carry travel adapters, check voltage compatibility, and bring a power bank."
673,What are some important travel etiquette tips?,"Respect local customs, be polite, and dress appropriately."
674,How do I deal with homesickness while traveling?,"Stay in touch with loved ones, keep busy, and create a routine."
675,What should I do if I lose my wallet while traveling?,"Report it, cancel cards, and use backup payment methods."
676,How can I support local economies while traveling?,"Buy local products, eat at local restaurants, and stay in local accommodations."
677,What are some tips for traveling with a baby?,"Pack extra supplies, plan for breaks, and keep the baby comfortable."
678,How do I prepare for a long bus or train journey?,"Bring snacks, entertainment, and travel pillows."
679,What should I know about travel restrictions?,"Check official sources, understand quarantine rules, and stay updated."
680,How can I make my travel photos better?,"Focus on lighting, composition, and capturing unique moments."
681,What are some tips for visiting historical sites?,"Hire a guide, read about the history, and go during off-peak times."
682,How do I avoid getting sick while traveling?,"Stay hydrated, wash hands frequently, and avoid street food."
683,What should I know about international travel with a disability?,"Research accessibility, inform airlines and hotels, and carry medical information."
684,What are some tips for staying fit while traveling?,"Incorporate physical activities into your itinerary, use hotel gyms, and do bodyweight exercises."
685,What are some tips for taking great travel videos?,"Stabilize your camera, plan your shots, and capture local sounds."
686,How do I handle foreign currency?,"Use credit cards when possible, exchange money at reputable places, and avoid carrying large amounts of cash."
687,What should I know about travel insurance coverage?,"Understand what is covered, read the fine print, and carry the policy details."
688,How do I find the best accommodation deals?,"Use comparison websites, book in advance, and consider alternative lodging options."
689,What are some tips for keeping kids entertained during travel?,"Bring games, books, and electronics, and plan kid-friendly activities."
690,How can I make my travel more sustainable?,"Choose eco-friendly transportation, support local businesses, and reduce waste."
691,What should I do if I miss my flight connection?,"Inform the airline, know your rights, and arrange for alternate flights."
692,What are some tips for visiting theme parks?,"Plan ahead, arrive early, and use fast passes."
693,How do I stay safe while hiking?,"Stay on marked trails, carry essentials, and inform someone of your route."
694,What should I pack for a cruise?,"Casual and formal wear, swimwear, sunscreen, and motion sickness remedies."
695,How can I manage my finances while traveling?,"Set a budget, use travel-friendly credit cards, and keep track of your expenses."
696,What are some tips for traveling with a baby?,"Pack extra supplies, keep the baby comfortable, and plan for breaks."
697,How do I find local events while traveling?,"Check local tourism websites, use event apps, and ask locals."
698,What should I know about international health insurance?,"Understand coverage abroad, check if your plan includes international travel, and consider supplemental insurance."
699,How can I improve my travel photography skills?,"Practice regularly, learn about your camera, and focus on composition."
700,What are some tips for visiting religious sites?,"Dress modestly, be respectful, and follow site-specific guidelines."
701,How do I avoid getting scammed while traveling?,"Stay alert, research common scams, and avoid overly friendly strangers."
702,What are some tips for staying healthy while traveling?,"Eat balanced meals, stay hydrated, and get enough rest."
703,What should I know about renting a vacation home?,"Read reviews, understand the policies, and communicate with the host."
704,How do I plan a family vacation?,"Involve everyone in planning, choose family-friendly activities, and keep a flexible schedule."
705,What are some tips for visiting zoos and aquariums?,"Go early, attend feeding times, and follow guidelines."
706,How can I find the best local restaurants?,"Ask locals, read reviews, and avoid touristy areas."
707,What should I know about travel rewards programs?,"Understand how to earn and redeem points, and join multiple programs for flexibility."
708,How do I choose a travel insurance policy?,"Compare coverage options, read reviews, and ensure it covers your needs."
709,What are some tips for staying hydrated while traveling?,"Carry a reusable water bottle, avoid excessive caffeine, and drink regularly."
710,How can I make the most of a weekend getaway?,"Plan ahead, pack light, and focus on a few key activities."
711,What should I know about traveling during holidays?,"Expect higher prices, book in advance, and be prepared for crowds."
712,How do I avoid motion sickness while traveling?,"Use motion sickness remedies, sit in stable areas, and avoid heavy meals."
713,What are some tips for visiting botanical gardens?,"Wear comfortable shoes, bring a camera, and check for guided tours."
714,How can I reduce my carbon footprint while traveling?,"Choose eco-friendly transport, support sustainable tourism, and reduce waste."
715,What should I pack for a road trip?,"Snacks, water, first aid kit, and entertainment."
716,How do I handle travel delays?,"Stay informed, keep essentials handy, and have a backup plan."
717,What are some tips for visiting amusement parks?,"Go early, use fast passes, and stay hydrated."
718,How can I stay entertained during long flights?,"Bring books, movies, and games, and plan for sleep."
719,What should I know about using public transportation abroad?,"Learn the system, buy tickets in advance, and stay aware of your surroundings."
720,How do I choose the right travel backpack?,"Consider size, comfort, and features like compartments and security."
721,What are some tips for visiting UNESCO World Heritage sites?,"Plan ahead, respect the site, and take guided tours."
722,How can I manage my budget while traveling?,"Set a daily limit, track expenses, and prioritize spending."
723,What should I know about travel vaccinations?,"Check required vaccines, get them in advance, and carry proof."
724,How do I find the best travel apps?,"Read reviews, ask for recommendations, and try free versions first."
725,What are some tips for visiting art galleries?,"Go during off-peak hours, take your time, and consider guided tours."
726,How can I avoid jet lag?,"Adjust your schedule before departure, stay hydrated, and get plenty of rest."
727,What should I pack for a beach vacation?,"Swimwear, sunscreen, hat, sunglasses, and a beach towel."
728,How do I choose the best travel insurance?,"Compare coverage options, read reviews, and ensure it covers your needs."
729,What are some tips for visiting wildlife reserves?,"Follow guidelines, keep a safe distance, and respect the environment."
730,How can I stay connected with loved ones while traveling?,"Use messaging apps, share your itinerary, and check in regularly."
731,What should I know about traveling with a baby?,"Pack extra supplies, keep the baby comfortable, and plan for breaks."
732,How do I handle language barriers?,"Learn basic phrases, use translation apps, and rely on body language."
733,What are some tips for visiting historical sites?,"Hire a guide, read about the history, and go during off-peak times."
734,How can I stay healthy while traveling?,"Eat balanced meals, stay hydrated, and get enough rest."
735,What should I know about renting a car abroad?,"Check rental requirements, insurance coverage, and local driving laws."
736,How do I avoid getting scammed while traveling?,"Stay alert, research common scams, and avoid overly friendly strangers."
737,What are some tips for visiting national parks?,"Follow guidelines, pack out trash, and stay on trails."
738,How can I make the most of a layover?,"Explore the airport amenities, take a city tour, or rest in a lounge."
739,What should I pack for a winter vacation?,"Warm layers, waterproof clothing, and thermal accessories."
740,How do I stay safe while traveling solo?,"Stay aware, trust your instincts, and avoid risky areas."
741,What are some tips for visiting museums?,"Go early, buy tickets in advance, and take guided tours."
742,How can I reduce travel stress?,"Plan ahead, stay flexible, and practice mindfulness."
743,What should I know about international driving permits?,"Check if required, apply in advance, and understand local driving laws."
744,How do I manage my finances while traveling?,"Set a budget, use travel-friendly credit cards, and keep track of expenses."
745,What are some tips for visiting religious sites?,"Dress modestly, be respectful, and follow site-specific guidelines."
746,How can I avoid overpacking?,"Use a packing list, choose versatile clothing, and limit electronics."
747,What should I do if I miss my flight?,"Contact the airline immediately, know your rights, and have a backup plan."
748,How do I stay organized while traveling?,"Use travel apps, keep an itinerary, and pack systematically."
749,What are some tips for visiting zoos?,"Go early, attend feeding times, and follow guidelines."
750,How can I find the best local restaurants?,"Ask locals, read reviews, and avoid touristy areas."
751,What should I know about travel insurance coverage?,"Understand what is covered, read the fine print, and carry policy details."
752,How do I handle travel anxiety?,"Prepare well, practice relaxation techniques, and focus on positive aspects."
753,What should I do if I encounter a wildlife emergency such as encountering an injured animal while traveling in natural areas?,"Contact local authorities or wildlife rescue organizations, do not attempt to handle or approach the animal yourself, and provide detailed information about the location and condition of the animal."
754,How can I reduce my carbon footprint while traveling?,"Choose eco-friendly transport, support sustainable tourism, and reduce waste."
755,What should I pack for a road trip?,"Snacks, water, first aid kit, and entertainment."
756,How do I handle travel delays?,"Stay informed, keep essentials handy, and have a backup plan."
757,What are some tips for visiting amusement parks?,"Go early, use fast passes, and stay hydrated."
758,How can I stay entertained during long flights?,"Bring books, movies, and games, and plan for sleep."
759,What should I know about using public transportation abroad?,"Learn the system, buy tickets in advance, and stay aware of your surroundings."
760,How do I choose the right travel backpack?,"Consider size, comfort, and features like compartments and security."
761,What are some tips for visiting UNESCO World Heritage sites?,"Plan ahead, respect the site, and take guided tours."
762,How can I manage my budget while traveling?,"Set a daily limit, track expenses, and prioritize spending."
763,What should I know about travel vaccinations?,"Check required vaccines, get them in advance, and carry proof."
764,How do I find the best travel apps?,"Read reviews, ask for recommendations, and try free versions first."
