index,question,answer
1,What documents do I need to carry while traveling internationally?,"You typically need a valid passport, visa (if required), and any other necessary identification or travel permits."
2,How far in advance should I book my flights for the best deals?,"Generally, booking flights 6-8 weeks before your travel date can yield the best prices, but this can vary depending on the destination and time of year."
3,What are some essential items to pack for a long trip?,"Items such as clothing appropriate for the destination's climate, toiletries, medications, travel adapters, chargers, and important documents like travel insurance and emergency contacts."
4,How can I stay safe while traveling solo?,"Research your destination beforehand, avoid risky areas, stay connected with family or friends, and trust your instincts. It's also helpful to have copies of important documents and to inform someone of your itinerary."
5,What are some tips for saving money while traveling?," Look for budget accommodations, eat where locals eat, use public transportation, and consider traveling during the off-peak season. Additionally, booking flights and accommodations in advance can often result in lower prices."
6,How can I minimize the environmental impact of my travels?," Choose eco-friendly accommodations, use public transportation or walk instead of renting a car, minimize plastic waste by using reusable water bottles and bags, and support local businesses and sustainable tourism initiatives."
7,What are some ways to overcome jet lag?,"Gradually adjust your sleep schedule before departure, stay hydrated, expose yourself to natural sunlight upon arrival, and avoid heavy meals and caffeine before bedtime."
8,What are some important cultural customs to be aware of when traveling to a foreign country?,"Research local customs, etiquette, and taboos beforehand. This may include appropriate dress codes, greetings, gestures, and dining etiquette."
9,How can I stay connected to friends and family while traveling internationally?,"Consider purchasing a local SIM card, using messaging apps with internet access, or relying on international roaming plans offered by your mobile provider. Additionally, many destinations offer free Wi-Fi in public areas."
10,What should I do in case of an emergency while traveling abroad?," Familiarize yourself with emergency contact numbers for local authorities and your country's embassy or consulate. Keep copies of important documents and travel insurance information, and register with your embassy if possible."
11,What are the benefits of travel insurance?,"Travel insurance can cover medical emergencies, trip cancellations, lost luggage, flight delays, and other unforeseen incidents, providing financial protection and peace of mind."
12,How do I find reliable travel information online?,"Use reputable travel websites, official tourism sites, and read reviews from multiple sources. Forums like TripAdvisor and Lonely Planet's Thorn Tree can also be useful."
13,What are some tips for traveling with children?,"Pack plenty of snacks and activities, schedule flights during nap times if possible, take breaks during long journeys, and ensure you have all necessary documents and medical supplies."
14,How can I avoid getting sick while traveling?,"Drink bottled or purified water, wash your hands frequently, eat at reputable places, and consider getting necessary vaccinations before traveling."
15,What is the best way to handle foreign currency exchange?,"Use ATMs for the best exchange rates, exchange a small amount of currency before you leave, and avoid airport exchange counters due to higher fees."
16,How can I make long flights more comfortable?,"Wear comfortable clothing, stay hydrated, bring a neck pillow, use noise-canceling headphones, and move around periodically to prevent stiffness."
17,What are the benefits of using a travel agent?,"Travel agents can save you time, provide expert advice, find deals, assist with complex itineraries, and offer support in case of issues during your trip."
18,How can I learn the local language quickly when traveling?,"Use language learning apps, carry a phrasebook, take a short language course before your trip, and practice with locals once you arrive."
19,What should I do if I lose my passport while abroad?,"Report the loss to local authorities, contact your country's embassy or consulate, and apply for an emergency travel document or replacement passport."
20,What are some unique souvenirs to buy from different countries?,"Look for local handicrafts, traditional clothing, local food products, art, and items that are unique to the culture and region you are visiting."
21,How can I make the most of a short layover in a new city?,"Research ahead of time, focus on one or two key attractions, use efficient transportation, and plan a realistic schedule to avoid missing your connecting flight."
22,What are some travel tips for seniors?,"Plan for shorter travel days, choose senior-friendly accommodations, keep medical information handy, stay hydrated, and take advantage of senior discounts."
23,How can I deal with travel anxiety?,"Plan thoroughly, stay organized, practice deep breathing techniques, and consider speaking to a healthcare professional for additional support."
24,What are some tips for eco-friendly packing?,"Use reusable containers, pack biodegradable toiletries, bring a reusable shopping bag, and choose eco-friendly products whenever possible."
25,What should I consider when choosing a travel destination?,"Think about your interests, budget, travel restrictions, safety, climate, and cultural attractions to select a destination that suits your preferences."
26,How do I avoid tourist traps?,"Research local tips, avoid peak tourist seasons, explore beyond popular areas, and seek recommendations from locals and experienced travelers."
27,What are some ways to document my travels?,"Keep a travel journal, take photos and videos, blog about your experiences, and use social media to share highlights with friends and family."
28,How do I find cheap accommodations?,"Use comparison websites, book in advance, consider hostels or vacation rentals, look for last-minute deals, and check for discounts or loyalty programs."
29,How can I travel with pets?,"Check airline pet policies, ensure your pet has the necessary vaccinations and documentation, choose pet-friendly accommodations, and pack essential pet supplies."
30,What are the benefits of group travel?,"Group travel can offer safety, shared experiences, potential cost savings, and the chance to meet new people. It can also provide guided support and local insights."
31,How do I choose the right travel gear?,"Consider the duration and nature of your trip, invest in quality items, prioritize lightweight and multi-functional gear, and read reviews to make informed choices."
32,What are some tips for traveling during a pandemic?,"Stay updated on travel advisories, follow health guidelines, carry sufficient masks and sanitizers, and be prepared for possible quarantine or health checks."
33,How do I plan a road trip?,"Map out your route, schedule rest stops, prepare your vehicle, pack essentials like food and first aid, and book accommodations in advance if needed."
34,What are some tips for traveling on a budget?,"Plan your budget, look for free activities, eat local street food, use public transportation, and take advantage of student, senior, or group discounts."
35,How can I avoid jet lag?,"Gradually adjust your sleep schedule before your trip, stay hydrated, get plenty of rest, and try to adapt to the local time zone as quickly as possible."
36,What are some safety tips for using public transportation abroad?,"Keep an eye on your belongings, avoid isolated stops at night, know the local emergency numbers, and familiarize yourself with the routes and schedules beforehand."
37,How do I handle language barriers when traveling?,"Learn basic phrases, use translation apps, carry a phrasebook, be patient, and use gestures or pictures to communicate when necessary."
38,What should I consider when traveling with a disability?,"Research accessibility options, inform your airline and accommodation of your needs, carry necessary medical supplies, and plan your itinerary with accessibility in mind."
39,How do I stay fit while traveling?,"Take advantage of hotel gyms, walk or bike instead of driving, do bodyweight exercises in your room, and explore outdoor activities like hiking or swimming."
40,What are some tips for booking last-minute travel?,"Use last-minute booking websites, be flexible with your dates and destinations, look for package deals, and consider traveling during the off-peak season."
41,How can I make my travel photos better?,"Use natural light, learn basic photography techniques, capture candid moments, pay attention to composition, and consider investing in a good camera or smartphone."
42,What are some tips for traveling with a tight schedule?,"Plan meticulously, prioritize must-see attractions, book tickets and accommodations in advance, and be prepared for potential delays."
43,How can I keep my belongings safe while traveling?,"Use a money belt or hidden pouch, avoid displaying valuables, use hotel safes, keep copies of important documents, and stay vigilant in crowded areas."
44,What are the best ways to explore a new city?,"Walk or bike to immerse yourself in the local atmosphere, join guided tours, use public transportation, and visit local markets and neighborhoods."
45,How can I stay healthy while eating out while traveling?,"Choose restaurants with good hygiene practices, eat fresh and cooked foods, avoid tap water in certain regions, and listen to your body’s needs."
46,What are some considerations for booking a cruise?,"Research the cruise line and itinerary, consider the season and weather, check for inclusions and extra costs, and read reviews from previous travelers."
47,How do I prepare for extreme weather conditions while traveling?,"Pack appropriate clothing and gear, stay updated on weather forecasts, have a plan for emergencies, and be flexible with your itinerary if needed."
48,What are some tips for visiting historical sites?,"Learn about the history beforehand, hire a local guide for in-depth knowledge, respect the site’s rules and customs, and take your time to fully appreciate the experience."
49,How can I travel sustainably?,"Choose eco-friendly accommodations, reduce plastic use, support local communities, offset your carbon footprint, and be mindful of your environmental impact."
50,What should I know about travel vaccinations?,"Check the vaccination requirements for your destination, get vaccinated well in advance, carry your vaccination certificate, and consult your doctor for advice."
51,How can I manage my travel budget effectively?,"Track your expenses, prioritize spending on experiences over things, look for discounts and deals, and set a daily budget to avoid overspending."
52,What are some tips for solo female travelers?,"Research destinations for safety, stay in well-reviewed accommodations, dress appropriately for the culture, stay connected with someone at home, and trust your instincts."
53,How do I plan a multi-destination trip?,"Plan your itinerary carefully, book transportation and accommodations in advance, ensure you have enough time at each location, and keep track of all bookings and documents."
54,What are some travel tips for business travelers?,"Pack light and efficiently, stay organized with a travel app, choose accommodations with business amenities, and manage your time to balance work and relaxation."
55,How can I make a long layover enjoyable?,"Explore the airport amenities, book a day room at an airport hotel, take a city tour if time allows, or use the time to relax and recharge."
56,What are some common travel scams to watch out for?,"Be wary of overly friendly strangers, avoid unlicensed taxis, check your change carefully, and be cautious of anyone offering deals that seem too good to be true."
57,How can I avoid overpacking?,"Make a packing list, choose versatile clothing, use packing cubes, limit shoes to essentials, and follow the one-week rule: pack for one week regardless of trip length."
58,What should I do if my flight gets canceled?,"Contact the airline immediately for rebooking, know your passenger rights, check for alternative flights, and consider travel insurance coverage for such events."
59,How do I choose the best travel insurance plan?,"Compare coverage options, read policy details carefully, check reviews and ratings, consider your trip specifics, and choose a plan that covers medical, cancellations, and lost belongings."
60,What are the benefits of staying in a hostel?,"Hostels offer budget-friendly accommodation, social opportunities, communal kitchens, and often have central locations. They are great for meeting other travelers and sharing experiences."
61,How do I plan an itinerary for a family trip?,"Include activities for all ages, allow for rest times, choose family-friendly accommodations, pre-book tickets to attractions, and involve everyone in the planning process."
62,What are some tips for dealing with travel fatigue?,"Rest well before your trip, stay hydrated, take short naps, break up long travel days, and allow yourself some downtime upon arrival."
63,How can I ensure my accommodation is safe?,"Read reviews, check for safety features like secure locks and surveillance, choose well-known brands or highly rated places, and contact the accommodation with any concerns before booking."
64,What are some must-have travel apps?,"Google Maps, TripAdvisor, Skyscanner, Airbnb, Duolingo, and a reliable currency converter. These apps can help with navigation, booking, learning languages, and managing expenses."
65,How do I find local events and festivals?,"Check tourism websites, use event discovery apps, visit local visitor centers, and ask locals or hotel staff for recommendations."
66,What should I do if my luggage gets lost?,"Report immediately to the airline's lost luggage desk, provide a detailed description, keep receipts for essentials you buy, and follow up regularly until your luggage is returned."
67,How can I travel comfortably on a budget airline?,"Bring your own snacks and water, dress in layers, use travel pillows and blankets, and be prepared for minimal legroom and additional charges for extras."
68,What are the advantages of using a travel credit card?,"Travel credit cards can offer rewards points, travel insurance, no foreign transaction fees, airport lounge access, and other perks that enhance your travel experience."
69,How can I stay organized while traveling?,"Use packing cubes, keep digital copies of important documents, use a travel wallet for essentials, and maintain a checklist for daily tasks and activities."
70,How do I choose the best time to travel?,"Consider the destination's peak seasons, weather, local events, and your own schedule flexibility. Traveling during shoulder seasons can offer better prices and fewer crowds."
71,What are some essential travel gadgets?,"Portable charger, noise-canceling headphones, universal travel adapter, compact camera, e-reader, and a travel-sized power strip for charging multiple devices."
72,How do I plan a romantic getaway?,"Choose a destination known for its romantic ambiance, book accommodations with special amenities, plan activities you both enjoy, and consider surprise elements to enhance the experience."
73,What are some travel tips for vegetarians and vegans?,"Research local cuisine, use apps to find vegetarian/vegan restaurants, learn key phrases in the local language, and consider booking accommodations with kitchen facilities."
74,How can I explore a destination like a local?,"Visit local markets, use public transportation, stay in residential neighborhoods, attend local events, and avoid major tourist attractions in favor of hidden gems."
75,What are some tips for taking night trains or buses?,"Bring a blanket and pillow, secure your belongings, wear comfortable clothing, have snacks and water, and use earplugs and an eye mask for better sleep."
76,How do I keep my electronic devices charged while traveling?,"Carry a portable charger, use a universal adapter, charge devices whenever possible, and consider a power bank with high capacity for long trips."
77,What are some tips for traveling during the holiday season?,"Book early, expect higher prices and crowds, pack patience, be flexible with your plans, and consider less popular destinations to avoid the holiday rush."
78,How do I stay healthy while traveling in remote areas?,"Carry a basic medical kit, drink bottled or purified water, eat cooked foods, get necessary vaccinations, and have a plan for medical emergencies."
79,What should I do if I encounter a natural disaster while traveling?,"Stay informed through local news, follow evacuation orders, contact your embassy, have an emergency kit ready, and inform family or friends of your situation."
80,What are the benefits of staying in an all-inclusive resort?,"All-inclusive resorts offer convenience, with meals, drinks, and activities included, allowing you to relax and enjoy your vacation without worrying about additional costs."
81,How do I find the best local food?,"Ask locals for recommendations, join food tours, explore street food markets, read food blogs, and avoid touristy areas where food quality might be compromised."
82,What are some tips for staying cool in hot climates?,"Stay hydrated, wear lightweight and breathable clothing, use sunscreen, take breaks in the shade, and avoid strenuous activities during peak heat hours."
83,How can I plan a successful camping trip?,"Choose a suitable campsite, pack essential gear, check weather forecasts, practice Leave No Trace principles, and plan meals and activities in advance."
84,How do I navigate cultural differences when traveling?,"Approach with respect and an open mind, learn about local customs, observe locals' behavior, ask politely if unsure, and avoid sensitive topics or actions."
85,What should I know about traveling to high-altitude destinations?,"Acclimatize gradually, stay hydrated, avoid alcohol, listen to your body, and be aware of symptoms of altitude sickness. Consider consulting a doctor before your trip."
86,How can I make the most of my travel rewards points?,"Choose a rewards program that suits your travel habits, use points for high-value rewards like flights or hotels, keep track of point expiration, and combine points with deals for maximum value."
87,What are some tips for visiting national parks?,"Plan your visit during off-peak times, make reservations early, follow park guidelines, respect wildlife, and prepare for variable weather conditions."
88,How do I handle a medical emergency while abroad?,"Contact local emergency services, visit a reputable medical facility, inform your travel insurance provider, and keep a record of all medical documents and expenses."
89,How can I prepare for a long-term trip?,"Create a detailed plan, arrange for long-term accommodations, set up a reliable communication method, manage your finances, and ensure you have all necessary visas and documents."
90,What are the benefits of renting a vacation home?,"Vacation homes offer more space, kitchen facilities, cost savings for groups, and a more local experience compared to hotels. They can also provide unique amenities."
91,How do I choose the best travel backpack?,"Consider size and capacity, look for comfort features like padded straps, check for durability and water resistance, and choose a design that suits your travel style."
92,What are some tips for staying warm in cold climates?,"Layer your clothing, wear thermal underwear, use insulated and waterproof outerwear, keep extremities covered with hats and gloves, and stay active to generate body heat."
93,How can I support local communities while traveling?,"Buy from local businesses, participate in community-based tourism, respect local customs and traditions, and engage with locals to learn about their way of life."
94,What should I do if I miss my flight?,"Inform the airline immediately, explore rebooking options, know your passenger rights, check travel insurance coverage, and stay calm while finding a solution."
95,How do I keep kids entertained during long trips?,"Pack travel-friendly games and activities, download movies and shows, plan for breaks, involve them in the travel experience, and bring comfort items like pillows or blankets."
96,What are some tips for traveling with dietary restrictions?,"Research local cuisine and ingredients, learn key phrases in the local language, carry snacks or special foods, communicate clearly with restaurant staff, and use apps to find suitable dining options."
97,How can I stay motivated to travel often?,"Set travel goals, follow travel blogs and social media for inspiration, join travel groups or communities, budget and save specifically for travel, and plan trips that excite you."
98,What are some safety tips for using ATMs abroad?,"Use ATMs in well-lit and busy areas, cover the keypad when entering your PIN, avoid using ATMs at night, and monitor your bank account regularly for any suspicious activity."
99,How can I enjoy layovers at major airports?,"Explore airport amenities like lounges, spas, and restaurants, use free Wi-Fi to catch up on work or entertainment, take a walk to stay active, and visit airport shops."
100,What should I know about driving in a foreign country?,"Research local driving laws, obtain an International Driving Permit if necessary, understand road signs, check your insurance coverage, and be aware of driving customs and conditions."
101,How do I prepare for a beach vacation?,"Pack sunscreen, swimwear, a hat, and sunglasses, stay hydrated, choose a beach with facilities you need, and be aware of local safety guidelines for swimming and sun exposure."
102,What are some tips for responsible wildlife tourism?,"Choose ethical tour operators, maintain a safe distance from animals, do not feed or touch wildlife, respect their natural habitats, and avoid attractions that exploit animals."
103,How can I save money on flights?,"Use flight comparison websites, set fare alerts, book in advance, be flexible with dates and airports, and consider budget airlines or connecting flights."
104,What are some considerations for booking an Airbnb?,"Read reviews carefully, check for amenities you need, communicate with the host, understand the cancellation policy, and ensure the location suits your travel plans."
105,How do I handle homesickness while traveling?,"Stay connected with loved ones, create a routine, keep busy with activities, bring comfort items from home, and remind yourself of the reasons you love traveling."
106,What are some tips for photographing landscapes?,"Shoot during the golden hour, use a tripod, consider the composition, use a wide-angle lens, and pay attention to the foreground and background for depth."
107,How can I make travel easier with a baby?,"Bring necessary baby supplies, choose family-friendly accommodations, maintain a routine, pack light but wisely, and plan for extra time and breaks."
108,What should I do if I get lost while traveling?,"Stay calm, use a map or GPS, ask locals for directions, retrace your steps, and have the address of your accommodation written down in the local language."
109,How do I find hidden gems in a destination?,"Talk to locals, explore beyond the tourist areas, use travel blogs and social media, join local tours, and be open to spontaneous discoveries."
110,What are some tips for visiting religious sites?,"Dress modestly, follow site-specific guidelines, be respectful of ongoing ceremonies, ask permission before taking photos, and learn about the site's cultural and religious significance."
111,How can I travel safely during the rainy season?,"Pack waterproof gear, monitor weather forecasts, plan indoor activities, be cautious of slippery surfaces, and allow extra travel time due to potential delays."
112,What are some tips for using rideshare services abroad?,"Check the availability of services in the destination, compare prices with local taxis, verify the driver and vehicle before getting in, and share your ride details with someone you trust."
113,How do I choose the best time to book a hotel?,"Book during off-peak seasons, compare prices across multiple platforms, look for last-minute deals, and consider non-refundable rates for better discounts."
114,What are some tips for visiting popular tourist attractions?,"Buy tickets in advance, visit early or late to avoid crowds, take guided tours for deeper insights, and explore lesser-known sections of the site."
115,How can I travel sustainably on a budget?,"Stay in eco-friendly accommodations, use public transportation, eat local food, minimize waste, and choose low-impact activities like hiking or biking."
116,What should I do if I lose my wallet while traveling?,"Report the loss to local authorities, contact your bank to cancel cards, use backup funds or traveler's cheques, and consider a travel insurance claim if necessary."
117,How do I plan a successful hiking trip?,"Choose a suitable trail for your experience level, check weather conditions, pack essentials like water and snacks, wear appropriate gear, and inform someone of your plans."
118,What are some tips for traveling in developing countries?,"Research health and safety information, be respectful of local customs, use bottled water, be cautious with street food, and support local businesses."
119,How can I make the most of a business trip?,"Schedule meetings efficiently, leave time for networking, explore the local area if possible, stay organized with a travel app, and balance work with relaxation."
